{
  "schema_version": "1.0.0",
  "algorithm": "articulated-pedagogical-diff-gradient",
  "category": "rigid-body",
  "derivation": {
    "doc": "tools/testkit/golden/derivations/articulated-pedagogical-diff-gradient.md",
    "upstream": "Featherstone-2008-ABA-Ch7 / central-FD-baseline / single-pendulum-analytic",
    "upstream_sha": "n/a-no-vendored-code",
    "upstream_path": "n/a-no-vendored-code"
  },
  "tolerance": {
    "absolute": 1e-06,
    "relative": 1e-05
  },
  "test_points": [
    {
      "inputs": {
        "anchor": "a1-state",
        "q": 0.3,
        "qd": 0.0,
        "length": 1.0,
        "mass": 1.0,
        "gravity": 9.81
      },
      "expected": {
        "dqddot_dq": -9.371850958322195
      },
      "independent_reference": {
        "source": "Analytic state-sensitivity of the ideal simple pendulum: the gravity-only point-mass EOM is q_ddot = -(g/L) sin q (I_com=0, pivot inertia mL^2), so d q_ddot/d q = -(g/L) cos q, closed-form. The wp.Tape adjoint through the landed Featherstone ABA kernel matches this to machine precision for the single pendulum (Stage-0 WARP-NATIVE-TAPE probe: relerr <= 1.9e-16). Source: rigid-body EOM / Featherstone (2008), Rigid Body Dynamics Algorithms, Ch. 7 sec 7.3 (simple-pendulum gravity-only limit, independent of the recursion). Hand-derived.",
        "derived_by": "closed-form-analytic (state-sensitivity)",
        "expected": {
          "dqddot_dq": -9.371850958322195
        }
      }
    },
    {
      "inputs": {
        "anchor": "a1-state",
        "q": 0.7,
        "qd": 0.0,
        "length": 1.0,
        "mass": 1.0,
        "gravity": 9.81
      },
      "expected": {
        "dqddot_dq": -7.503101857260832
      },
      "independent_reference": {
        "source": "Analytic state-sensitivity of the ideal simple pendulum: the gravity-only point-mass EOM is q_ddot = -(g/L) sin q (I_com=0, pivot inertia mL^2), so d q_ddot/d q = -(g/L) cos q, closed-form. The wp.Tape adjoint through the landed Featherstone ABA kernel matches this to machine precision for the single pendulum (Stage-0 WARP-NATIVE-TAPE probe: relerr <= 1.9e-16). Source: rigid-body EOM / Featherstone (2008), Rigid Body Dynamics Algorithms, Ch. 7 sec 7.3 (simple-pendulum gravity-only limit, independent of the recursion). Hand-derived.",
        "derived_by": "closed-form-analytic (state-sensitivity)",
        "expected": {
          "dqddot_dq": -7.503101857260832
        }
      }
    },
    {
      "inputs": {
        "anchor": "a1-state",
        "q": 1.2,
        "qd": 0.0,
        "length": 1.0,
        "mass": 1.0,
        "gravity": 9.81
      },
      "expected": {
        "dqddot_dq": -3.554729571416168
      },
      "independent_reference": {
        "source": "Analytic state-sensitivity of the ideal simple pendulum: the gravity-only point-mass EOM is q_ddot = -(g/L) sin q (I_com=0, pivot inertia mL^2), so d q_ddot/d q = -(g/L) cos q, closed-form. The wp.Tape adjoint through the landed Featherstone ABA kernel matches this to machine precision for the single pendulum (Stage-0 WARP-NATIVE-TAPE probe: relerr <= 1.9e-16). Source: rigid-body EOM / Featherstone (2008), Rigid Body Dynamics Algorithms, Ch. 7 sec 7.3 (simple-pendulum gravity-only limit, independent of the recursion). Hand-derived.",
        "derived_by": "closed-form-analytic (state-sensitivity)",
        "expected": {
          "dqddot_dq": -3.554729571416168
        }
      }
    },
    {
      "inputs": {
        "anchor": "a2-fd",
        "q": 0.5,
        "qd": 0.0,
        "length": 1.0,
        "mass": 1.0,
        "gravity": 9.81
      },
      "expected": {
        "dqddot_dq": -8.609084932498234
      },
      "independent_reference": {
        "source": "Central finite-difference baseline d q_ddot/d q ~ (q_ddot(q+eps) - q_ddot(q-eps))/(2 eps), eps=1e-6, O(eps^2). An independent numerical method (parameter perturbation of the forward ABA) cross-checking the wp.Tape autodiff engine; close-R2 numerical-baseline exemption.",
        "derived_by": "central-finite-difference (numerical baseline)",
        "expected": {
          "dqddot_dq": -8.609084932498234
        }
      }
    },
    {
      "inputs": {
        "anchor": "a2-fd",
        "q": 1.0,
        "qd": 0.0,
        "length": 1.0,
        "mass": 1.0,
        "gravity": 9.81
      },
      "expected": {
        "dqddot_dq": -5.300365620186653
      },
      "independent_reference": {
        "source": "Central finite-difference baseline d q_ddot/d q ~ (q_ddot(q+eps) - q_ddot(q-eps))/(2 eps), eps=1e-6, O(eps^2). An independent numerical method (parameter perturbation of the forward ABA) cross-checking the wp.Tape autodiff engine; close-R2 numerical-baseline exemption.",
        "derived_by": "central-finite-difference (numerical baseline)",
        "expected": {
          "dqddot_dq": -5.300365620186653
        }
      }
    },
    {
      "inputs": {
        "anchor": "a3-torque",
        "q": 0.6,
        "qd": 0.0,
        "length": 1.0,
        "mass": 1.0,
        "gravity": 9.81
      },
      "expected": {
        "dqddot_dtau": 1.0
      },
      "independent_reference": {
        "source": "Analytic torque-sensitivity d q_ddot/d tau = H^-1 = 1/(I_com + m cdist^2) = 1/(mL^2) for the single link (joint-space inertia inversion / parallel-axis), closed-form and configuration-independent. Distinct physical term (torque- not state-sensitivity), parameter (tau not q), and method (inertia inversion not gravity linearization). Source: Featherstone (2008) ABA single-link inertia. Hand-derived.",
        "derived_by": "closed-form-analytic (torque-sensitivity)",
        "expected": {
          "dqddot_dtau": 1.0
        }
      }
    },
    {
      "inputs": {
        "anchor": "a3-torque",
        "q": 0.6,
        "qd": 0.0,
        "length": 2.0,
        "mass": 0.5,
        "gravity": 9.81
      },
      "expected": {
        "dqddot_dtau": 0.5
      },
      "independent_reference": {
        "source": "Analytic torque-sensitivity d q_ddot/d tau = H^-1 = 1/(I_com + m cdist^2) = 1/(mL^2) for the single link (joint-space inertia inversion / parallel-axis), closed-form and configuration-independent. Distinct physical term (torque- not state-sensitivity), parameter (tau not q), and method (inertia inversion not gravity linearization). Source: Featherstone (2008) ABA single-link inertia. Hand-derived.",
        "derived_by": "closed-form-analytic (torque-sensitivity)",
        "expected": {
          "dqddot_dtau": 0.5
        }
      }
    }
  ]
}
