{
  "schema_version": "1.0.0",
  "algorithm": "rigid-body-simple-pendulum-elliptic",
  "category": "rigid-body",
  "derivation": {
    "doc": "tools/testkit/golden/derivations/rigid-body-pendulum.md",
    "upstream": "n/a-textbook",
    "upstream_path": "n/a",
    "upstream_sha": "n/a"
  },
  "tolerance": {
    "absolute": 0.01,
    "relative": 0.001
  },
  "test_points": [
    {
      "inputs": {
        "quantity": "small_angle_period",
        "length": 1.0,
        "gravity": 9.81
      },
      "expected": {
        "value": 2.0060666807106475
      },
      "independent_reference": {
        "derived_by": "closed-form",
        "source": "Marion & Thornton 5e 3.2: T0 = 2*pi*sqrt(L/g)",
        "doi": "n/a-textbook"
      }
    },
    {
      "inputs": {
        "quantity": "large_angle_period",
        "length": 1.0,
        "gravity": 9.81,
        "theta0": 2.0
      },
      "expected": {
        "value": 2.665870942834926
      },
      "independent_reference": {
        "derived_by": "scipy.special.ellipk (complete K)",
        "source": "NIST DLMF 19.2 + 22.19(i): T = 4*sqrt(L/g)*K(sin(theta0/2))",
        "doi": "n/a-DLMF-19.2"
      }
    },
    {
      "inputs": {
        "quantity": "theta_at_t",
        "length": 1.0,
        "gravity": 9.81,
        "theta0": 2.0,
        "t": 0.2
      },
      "expected": {
        "value": 1.5356228422209777
      },
      "independent_reference": {
        "derived_by": "scipy.special.ellipj (Jacobi cn)",
        "source": "NIST DLMF 22.19(i): theta(t)=2*arcsin(sin(theta0/2)*cn(omega0*t, k))",
        "doi": "n/a-DLMF-22.19"
      }
    },
    {
      "inputs": {
        "quantity": "theta_at_t",
        "length": 1.0,
        "gravity": 9.81,
        "theta0": 2.0,
        "t": 0.5
      },
      "expected": {
        "value": 0.4871480911611571
      },
      "independent_reference": {
        "derived_by": "scipy.special.ellipj (Jacobi cn)",
        "source": "NIST DLMF 22.19(i): theta(t)=2*arcsin(sin(theta0/2)*cn(omega0*t, k))",
        "doi": "n/a-DLMF-22.19"
      }
    },
    {
      "inputs": {
        "quantity": "theta_at_t",
        "length": 1.0,
        "gravity": 9.81,
        "theta0": 2.0,
        "t": 0.8
      },
      "expected": {
        "value": -0.3870983004072668
      },
      "independent_reference": {
        "derived_by": "scipy.special.ellipj (Jacobi cn)",
        "source": "NIST DLMF 22.19(i): theta(t)=2*arcsin(sin(theta0/2)*cn(omega0*t, k))",
        "doi": "n/a-DLMF-22.19"
      }
    },
    {
      "inputs": {
        "quantity": "theta_at_t",
        "length": 1.0,
        "gravity": 9.81,
        "theta0": 2.0,
        "t": 1.1
      },
      "expected": {
        "value": -1.4141170182417444
      },
      "independent_reference": {
        "derived_by": "scipy.special.ellipj (Jacobi cn)",
        "source": "NIST DLMF 22.19(i): theta(t)=2*arcsin(sin(theta0/2)*cn(omega0*t, k))",
        "doi": "n/a-DLMF-22.19"
      }
    },
    {
      "inputs": {
        "quantity": "theta_at_t",
        "length": 1.0,
        "gravity": 9.81,
        "theta0": 2.0,
        "t": 1.4
      },
      "expected": {
        "value": -1.933925353278252
      },
      "independent_reference": {
        "derived_by": "scipy.special.ellipj (Jacobi cn)",
        "source": "NIST DLMF 22.19(i): theta(t)=2*arcsin(sin(theta0/2)*cn(omega0*t, k))",
        "doi": "n/a-DLMF-22.19"
      }
    }
  ]
}
